{
  "acr_version": "0.1.0",
  "record_type": "agent_change_record",
  "record_id": "acr_202605091617-362W7W",
  "created_at": "2026-05-09T17:06:20.235Z",
  "producer": {
    "name": "agentplane",
    "version": "0.4.2"
  },
  "repository": {
    "vcs": "git",
    "remote": "https://github.com/basilisk-labs/agentplane",
    "base_ref": "main",
    "base_commit": "5c8b9d2c955132845712a7a6f322abd58e1932e1",
    "work_ref": "main",
    "work_commit": "5c8b9d2c955132845712a7a6f322abd58e1932e1"
  },
  "task": {
    "task_id": "202605091617-362W7W",
    "title": "Bound evaluator rework attempts in transition state machine",
    "intent": "Update task verification transition logic so each needs_rework increments attempts, return path is preserved, and attempts exceeding max transition to blocked_external with status BLOCKED.",
    "requested_by": {
      "type": "agentplane_role",
      "id": "ORCHESTRATOR"
    }
  },
  "agent": {
    "id": "INTEGRATOR",
    "name": "INTEGRATOR",
    "agent_type": "coding_agent",
    "model": {
      "provider": "unknown",
      "name": "unknown",
      "version": "unknown"
    },
    "toolchain": [
      {
        "name": "agentplane",
        "version": "0.4.2"
      }
    ]
  },
  "plan": {
    "status": "approved",
    "artifact": {
      "path": ".agentplane/tasks/202605091617-362W7W/README.md",
      "sha256": "sha256:e195b9f79bcedd5f106fb7fb0e7fc8f926ac9de6df798978a326f89b06f46f76"
    },
    "approved_at": "2026-05-09T16:18:19.040Z",
    "approved_by": {
      "type": "agentplane_role",
      "id": "ORCHESTRATOR"
    }
  },
  "permissions": {
    "network": {
      "mode": "unknown"
    },
    "secrets": {
      "access": "none"
    },
    "tools": [
      {
        "name": "shell",
        "allowed": true
      }
    ]
  },
  "policy": {
    "policy_version": "0.1.0",
    "decisions": [
      {
        "rule_id": "plan.required",
        "decision": "pass",
        "reason": "Approved plan exists."
      },
      {
        "rule_id": "verification.required",
        "decision": "pass",
        "reason": "Verification is recorded as ok."
      }
    ]
  },
  "changes": {
    "summary": "Update task verification transition logic so each needs_rework increments attempts, return path is preserved, and attempts exceeding max transition to blocked_external with status BLOCKED.",
    "diff_stats": {
      "files_changed": 0,
      "insertions": 0,
      "deletions": 0
    },
    "files": [],
    "risk": {
      "level": "medium",
      "categories": [],
      "protected_paths_touched": false
    }
  },
  "verification": {
    "status": "passed",
    "checks": []
  },
  "approvals": [
    {
      "approval_id": "approval_202605091617-362W7W_plan",
      "type": "plan_approval",
      "decision": "approved",
      "approved_by": {
        "type": "agentplane_role",
        "id": "ORCHESTRATOR"
      },
      "approved_at": "2026-05-09T16:18:19.040Z",
      "scope": "task"
    }
  ],
  "evidence": [
    {
      "type": "task",
      "path": ".agentplane/tasks/202605091617-362W7W/README.md",
      "sha256": "sha256:e195b9f79bcedd5f106fb7fb0e7fc8f926ac9de6df798978a326f89b06f46f76"
    },
    {
      "type": "plan",
      "path": ".agentplane/tasks/202605091617-362W7W/README.md",
      "sha256": "sha256:e195b9f79bcedd5f106fb7fb0e7fc8f926ac9de6df798978a326f89b06f46f76"
    },
    {
      "type": "verification_log",
      "path": ".agentplane/tasks/202605091617-362W7W/README.md",
      "sha256": "sha256:e195b9f79bcedd5f106fb7fb0e7fc8f926ac9de6df798978a326f89b06f46f76"
    },
    {
      "type": "other",
      "path": ".agentplane/tasks/202605091617-362W7W/blueprint/resolved-snapshot.json",
      "sha256": "sha256:ae14eca300d64fa1d32767050aab9b79f5e7b94a7dac4fda988c1708c00906fe"
    }
  ],
  "result": {
    "status": "finished",
    "merge_ready": false,
    "residual_risks": [
      "Passed verification has no checks."
    ],
    "rollback": {
      "available": true,
      "notes": "Revert work_commit 5c8b9d2c955132845712a7a6f322abd58e1932e1 if downstream validation fails."
    }
  },
  "integrity": {
    "digest_algorithm": "sha256",
    "record_digest": "sha256:291f471bbe2c3daf96b5d4d6c808e3dd68326145b6325560c161e8e722ffb0ed",
    "canonicalization": "rfc8785-jcs",
    "signatures": []
  },
  "extensions": {
    "agentplane.blueprint": {
      "blueprint_id": "code.branch_pr",
      "blueprint_version": 1,
      "workflow_mode": "branch_pr",
      "route": [
        "intake",
        "scope",
        "approval_gate",
        "context_resolve",
        "worktree_start",
        "work_unit",
        "fast_local_checks",
        "pr_artifact",
        "hosted_checks",
        "publish_or_integrate",
        "verify_record",
        "finish"
      ],
      "required_evidence": [
        {
          "id": "code_pr.paths",
          "kind": "changed_paths",
          "produced_by": "work_unit",
          "required": true
        },
        {
          "id": "code_pr.fast_checks",
          "kind": "check_result",
          "produced_by": "fast_local_checks",
          "required": true
        },
        {
          "id": "code_pr.pr",
          "kind": "external_link",
          "produced_by": "pr_artifact",
          "required": true
        },
        {
          "id": "code_pr.hosted",
          "kind": "check_result",
          "produced_by": "hosted_checks",
          "required": true
        },
        {
          "id": "code_pr.commit",
          "kind": "commit",
          "produced_by": "publish_or_integrate",
          "required": true
        }
      ],
      "accepted_recipe_extensions": [],
      "rejected_recipe_extensions": [],
      "stop_reasons": [],
      "snapshot": {
        "state": "current",
        "path": ".agentplane/tasks/202605091617-362W7W/blueprint/resolved-snapshot.json",
        "digest": "2afcb6f1278e1042599da033004175e436ad936cd3e8763cf7f2d70b70a97d3f",
        "current_digest": "2afcb6f1278e1042599da033004175e436ad936cd3e8763cf7f2d70b70a97d3f",
        "route_changed": false,
        "artifact_sha256": "sha256:ae14eca300d64fa1d32767050aab9b79f5e7b94a7dac4fda988c1708c00906fe",
        "safe_command": "agentplane blueprint snapshot 202605091617-362W7W"
      }
    }
  }
}
